{"$schema":"http://json-schema.org/draft-07/schema#","title":"Playbook rules","type":"array","minItems":1,"items":{"type":"object","required":["id","version","title","category","priority","basis","profiles","check","guide","review","remediation","references","last_reviewed"],"additionalProperties":false,"properties":{"id":{"type":"string","pattern":"^[A-Z]+-[0-9]{3}$"},"version":{"type":"integer","minimum":1},"title":{"type":"string","minLength":1},"category":{"type":"string","minLength":1},"priority":{"enum":["high","medium","low"]},"basis":{"enum":["editorial-policy","platform-behaviour","external-standard","project-policy"]},"profiles":{"type":"array","minItems":1,"uniqueItems":true,"items":{"enum":["documentation","catalogue","library","application"]}},"check":{"enum":["file","community","workflow","readme-sections","local-links","badge-scope","manual","setting","workflow-security","dependency-coverage"]},"guide":{"type":"string","pattern":"^handbook/[a-z-]+\\.md$"},"review":{"type":"string","minLength":1},"remediation":{"type":"string","minLength":1},"references":{"type":"array","minItems":1,"items":{"type":"string","pattern":"^https://"}},"last_reviewed":{"type":"string","pattern":"^[0-9]{4}-[0-9]{2}-[0-9]{2}$"},"paths":{"type":"array","minItems":1,"uniqueItems":true,"items":{"type":"string","minLength":1}},"fact":{"type":"string","minLength":1}}}}
