[
{"id":"DISC-001","version":1,"title":"Explain the repository in its About description","category":"discoverability","priority":"medium","basis":"editorial-policy","profiles":["documentation","catalogue","library","application"],"check":"setting","guide":"handbook/discoverability.md","review":"Write a specific description naming the audience and output.","remediation":"Write a specific description naming the audience and output.","references":["https://docs.github.com/en/repositories/creating-and-managing-repositories/best-practices-for-repositories"],"last_reviewed":"2026-10-08","fact":"description_present"},
{"id":"DISC-002","version":1,"title":"Use relevant repository topics","category":"discoverability","priority":"low","basis":"editorial-policy","profiles":["documentation","catalogue","library","application"],"check":"setting","guide":"handbook/discoverability.md","review":"Select accurate topics that match the implemented scope; do not keyword-stuff.","remediation":"Select accurate topics that match the implemented scope; do not keyword-stuff.","references":["https://docs.github.com/en/repositories/creating-and-managing-repositories/best-practices-for-repositories"],"last_reviewed":"2026-10-08","fact":"topics_present"},
{"id":"DOC-001","version":1,"title":"Provide a nonempty README","category":"documentation","priority":"high","basis":"editorial-policy","profiles":["documentation","catalogue","library","application"],"check":"file","guide":"handbook/readme.md","review":"Add a Markdown README explaining the project and its first-use path.","remediation":"Add a Markdown README explaining the project and its first-use path.","references":["https://docs.github.com/en/repositories/managing-your-repositorys-settings-and-features/customizing-your-repository/about-readmes"],"last_reviewed":"2026-10-08","paths":["README.md",".github/README.md","docs/README.md","readme.md"]},
{"id":"DOC-002","version":1,"title":"State purpose, audience and boundaries","category":"documentation","priority":"high","basis":"editorial-policy","profiles":["documentation","catalogue","library","application"],"check":"manual","guide":"handbook/readme.md","review":"Ask an unfamiliar reader to identify what this does, for whom, and what it does not do.","remediation":"Ask an unfamiliar reader to identify what this does, for whom, and what it does not do.","references":["https://docs.github.com/en/repositories/managing-your-repositorys-settings-and-features/customizing-your-repository/about-readmes"],"last_reviewed":"2026-10-08"},
{"id":"DOC-003","version":1,"title":"Provide a complete first-use sequence","category":"onboarding","priority":"high","basis":"editorial-policy","profiles":["documentation","catalogue","library","application"],"check":"readme-sections","guide":"handbook/readme.md","review":"Check prerequisites, clone or installation, working directory, commands and expected output. Alternate heading names are acceptable.","remediation":"Check prerequisites, clone or installation, working directory, commands and expected output. Alternate heading names are acceptable.","references":["https://docs.github.com/en/repositories/managing-your-repositorys-settings-and-features/customizing-your-repository/about-readmes"],"last_reviewed":"2026-10-08"},
{"id":"DOC-004","version":1,"title":"Keep supported local Markdown targets resolvable","category":"documentation","priority":"medium","basis":"editorial-policy","profiles":["documentation","catalogue","library","application"],"check":"local-links","guide":"handbook/automation.md","review":"Repair missing local files and references; manually verify deferred anchors and complex Markdown syntax.","remediation":"Repair missing local files and references; manually verify deferred anchors and complex Markdown syntax.","references":["https://docs.github.com/en/actions/reference/security/secure-use"],"last_reviewed":"2026-10-08"},
{"id":"DOC-005","version":1,"title":"Use purposeful and accessible badges","category":"presentation","priority":"low","basis":"editorial-policy","profiles":["documentation","catalogue","library","application"],"check":"manual","guide":"handbook/badges.md","review":"Explain each badge claim, use meaningful alt text and a useful click target, and remove redundant decoration.","remediation":"Explain each badge claim, use meaningful alt text and a useful click target, and remove redundant decoration.","references":["https://shields.io/badges/git-hub-actions-workflow-status"],"last_reviewed":"2026-10-08"},
{"id":"DOC-006","version":1,"title":"Scope workflow badges to branch and event","category":"presentation","priority":"low","basis":"editorial-policy","profiles":["documentation","catalogue","library","application"],"check":"badge-scope","guide":"handbook/badges.md","review":"Set explicit branch and event parameters on recognised CI badge URLs. This is a playbook preference, not a platform requirement.","remediation":"Set explicit branch and event parameters on recognised CI badge URLs. This is a playbook preference, not a platform requirement.","references":["https://shields.io/badges/git-hub-actions-workflow-status"],"last_reviewed":"2026-10-08"},
{"id":"DOC-007","version":1,"title":"Disclose limitations and evidence","category":"documentation","priority":"high","basis":"editorial-policy","profiles":["documentation","catalogue","library","application"],"check":"manual","guide":"handbook/documentation.md","review":"Separate implemented, tested, measured, inferred and unknown claims. Include environments for measurements.","remediation":"Separate implemented, tested, measured, inferred and unknown claims. Include environments for measurements.","references":["https://docs.github.com/en/repositories/creating-and-managing-repositories/best-practices-for-repositories"],"last_reviewed":"2026-10-08"},
{"id":"DOC-008","version":1,"title":"Provide useful documentation navigation","category":"documentation","priority":"medium","basis":"editorial-policy","profiles":["documentation","catalogue","library","application"],"check":"manual","guide":"handbook/documentation.md","review":"Keep the README as an entry point; link guides, reference, architecture and troubleshooting without duplicating authority.","remediation":"Keep the README as an entry point; link guides, reference, architecture and troubleshooting without duplicating authority.","references":["https://docs.github.com/en/repositories/creating-and-managing-repositories/best-practices-for-repositories"],"last_reviewed":"2026-10-08"},
{"id":"STRUCT-001","version":1,"title":"Explain the actual repository layout","category":"structure","priority":"medium","basis":"editorial-policy","profiles":["documentation","catalogue","library","application"],"check":"manual","guide":"handbook/structure.md","review":"Map source inputs, runtime code, tests, examples and generated outputs. Do not reorganise only to match a fashionable template.","remediation":"Map source inputs, runtime code, tests, examples and generated outputs. Do not reorganise only to match a fashionable template.","references":["https://docs.github.com/en/repositories/creating-and-managing-repositories/best-practices-for-repositories"],"last_reviewed":"2026-10-08"},
{"id":"STRUCT-002","version":1,"title":"Identify authoritative and generated files","category":"structure","priority":"medium","basis":"editorial-policy","profiles":["documentation","catalogue","library","application"],"check":"manual","guide":"handbook/structure.md","review":"Document source ownership and regeneration commands; prevent manual edits to derived content.","remediation":"Document source ownership and regeneration commands; prevent manual edits to derived content.","references":["https://docs.github.com/en/repositories/creating-and-managing-repositories/best-practices-for-repositories"],"last_reviewed":"2026-10-08"},
{"id":"STRUCT-003","version":1,"title":"Document editor whitespace conventions","category":"structure","priority":"low","basis":"editorial-policy","profiles":["documentation","catalogue","library","application"],"check":"file","guide":"handbook/structure.md","review":"Add a project-appropriate .editorconfig rather than relying on personal editor settings.","remediation":"Add a project-appropriate .editorconfig rather than relying on personal editor settings.","references":["https://docs.github.com/en/repositories/creating-and-managing-repositories/best-practices-for-repositories"],"last_reviewed":"2026-10-08","paths":[".editorconfig"]},
{"id":"COMM-001","version":1,"title":"Provide contribution instructions","category":"community","priority":"medium","basis":"editorial-policy","profiles":["documentation","catalogue","library","application"],"check":"community","guide":"handbook/contribution.md","review":"Document setup, validation and review expectations. Check inherited defaults before declaring a local absence a failure.","remediation":"Document setup, validation and review expectations. Check inherited defaults before declaring a local absence a failure.","references":["https://docs.github.com/en/communities/setting-up-your-project-for-healthy-contributions/creating-a-default-community-health-file"],"last_reviewed":"2026-10-08","paths":["CONTRIBUTING.md",".github/CONTRIBUTING.md","docs/CONTRIBUTING.md"]},